{
  "item_id": "CONV-NY-OMIG-ALP-27",
  "item_name": "Missing Patient Review Instrument (PRI)",
  "section": "CONV",
  "instrument": "UAS-NY",
  "lookback_days": null,
  "lookback_notes": "NOT_FOUND. Audit Area 27 (Missing Patient Review Instrument) states no observation/look-back window. A 7-day look-back is stated only for a different audit area (Area 30, 'Patient Review Instrument Invalid Resident not on site for the look back period', p. 18), and the document does not extend it to Area 27. The page does state a service-date scope for this area: the page header reads '(For Service Dates 01/01/2013 through 02/28/2015)' and the section heading reads 'For Services Dates Prior to 03/01/2015', with the note that findings below were phased out per NYS DOH Medicaid Update, February 2013, Vol. 29, No. 3.",
  "coding_levels": [],
  "federal_coding_rules": [
    {
      "rule": "If the Patient Review Instrument applicable for the claim under review is missing, the claim will be disallowed.",
      "source": {
        "doc": "omig-alp-protocol-2025-12",
        "loc": "p. 17",
        "quote": "If the Patient Review Instrument applicable for the claim under review is missing, the claim will be disallowed."
      }
    },
    {
      "rule": "This audit area applies to service dates prior to 03/01/2015; the findings in this section were phased out per NYS DOH Medicaid Update, February 2013, Vol. 29, No. 3.",
      "source": {
        "doc": "omig-alp-protocol-2025-12",
        "loc": "p. 17",
        "quote": "For Services Dates Prior to 03/01/2015\nFindings below phased out as per NYS DOH Medicaid Update, February 2013, Vol. 29, No. 3"
      }
    },
    {
      "rule": "The service-date range printed for this portion of the protocol is 01/01/2013 through 02/28/2015.",
      "source": {
        "doc": "omig-alp-protocol-2025-12",
        "loc": "p. 17",
        "quote": "(For Service Dates 01/01/2013 through 02/28/2015)"
      }
    }
  ],
  "supportive_documentation": {
    "federal": [
      {
        "criterion": "The Patient Review Instrument applicable for the claim under review must be present in the record; absence results in disallowance of the claim.",
        "source": {
          "doc": "omig-alp-protocol-2025-12",
          "loc": "p. 17",
          "quote": "If the Patient Review Instrument applicable for the claim under review is missing, the claim will be disallowed."
        },
        "verified_by_expert": false,
        "audit_weight": "high",
        "notes": "Stated as OMIG Audit Criteria for Area 27."
      }
    ],
    "state": {}
  },
  "state_deltas": [],
  "case_mix_relevance": {
    "level": "unknown",
    "notes": "Area 27 itself does not tie the PRI to a payment or case-mix classification. (A separate area, 29. Incorrect PRI Level Claimed, addresses payment differences, but that is a different audit area and is not extracted here.)"
  },
  "conflicts": [],
  "common_audit_citations": [
    {
      "citation": "10 NYCRR \u00a7 86-2.30(c)",
      "notes": "Listed under Regulatory References for Area 27.",
      "source": {
        "doc": "omig-alp-protocol-2025-12",
        "loc": "p. 17",
        "quote": "10 NYCRR \u00a7 86-2.30(c)"
      }
    },
    {
      "citation": "10 NYCRR \u00a7 766.6(a)(3)",
      "notes": "Listed under Regulatory References for Area 27.",
      "source": {
        "doc": "omig-alp-protocol-2025-12",
        "loc": "p. 17",
        "quote": "10 NYCRR \u00a7 766.6(a)(3)"
      }
    },
    {
      "citation": "18 NYCRR \u00a7 504.3(i)",
      "notes": "Listed under Regulatory References for Area 27.",
      "source": {
        "doc": "omig-alp-protocol-2025-12",
        "loc": "p. 17",
        "quote": "18 NYCRR \u00a7 504.3(i)"
      }
    },
    {
      "citation": "NYS DOH DAL HCBS 08-02: Completion of the PRI for Individuals Participating in the ALP",
      "notes": "Listed under Regulatory References for Area 27.",
      "source": {
        "doc": "omig-alp-protocol-2025-12",
        "loc": "p. 17",
        "quote": "NYS DOH DAL HCBS 08-02: Completion of the PRI for Individuals Participating in \nthe ALP"
      }
    }
  ],
  "not_found": [
    "lookback_days",
    "lookback_source",
    "coding_levels",
    "state_deltas",
    "case_mix_relevance.source"
  ],
  "provenance_summary": {
    "extracted_at": "2026-09-12",
    "model": "claude-opus-5",
    "extractor_version": "0.1.0",
    "expert_review_status": "unreviewed",
    "source_documents": [
      {
        "doc": "omig-alp-protocol-2025-12"
      }
    ]
  },
  "version": "0.1.0"
}
