{
  "item_id": "E0600B",
  "item_name": "Impact on Others — Significantly Intrude on the Privacy or Activity of Others",
  "section": "E",
  "instrument": "MDS-3.0",
  "lookback_days": 7,
  "lookback_source": {
    "doc": "rai-manual-v1.20.1",
    "loc": "p. E-11",
    "quote": "Consider the previous review of the clinical record, staff interviews across all shifts and disciplines, interviews with others who had close interactions with the resident and previous observations of the behaviors identified in E0200 for the 7-day look-back period."
  },
  "lookback_notes": "The item's own Steps for Assessment page (p. E-11) states the behaviors identified in E0200 are considered for the 7-day look-back period. Counted per the general convention as the ARD plus the 6 previous calendar days (rai-manual-v1.20.1, p. 2-17: \"ARD + 6 previous calendar days\").",
  "coding_levels": [
    {
      "code": "0",
      "label": "No",
      "definition": "None of the identified behavioral symptom(s) significantly intruded on the privacy or activity of others.",
      "source": {
        "doc": "rai-manual-v1.20.1",
        "loc": "p. E-11",
        "quote": "Code 0, no: if none of the identified behavioral symptom(s) significantly intruded on the privacy or activity of others."
      }
    },
    {
      "code": "1",
      "label": "Yes",
      "definition": "Any of the identified behavioral symptom(s) kept other residents from enjoying privacy or engaging in informal activities (not organized or run by staff). Includes coming in uninvited, invading, or forcing oneself on others' private activities.",
      "source": {
        "doc": "rai-manual-v1.20.1",
        "loc": "p. E-11",
        "quote": "Code 1, yes: if any of the identified behavioral symptom(s) kept other residents from enjoying privacy or engaging in informal activities (not organized or run by staff). Includes coming in uninvited, invading, or forcing oneself on others' private activities."
      }
    }
  ],
  "federal_coding_rules": [
    {
      "rule": "E0600 (including E0600B) is completed only when E0300 is coded 1, yes (i.e., any of E0200A, E0200B, or E0200C were coded 1, 2, or 3); if E0300 is coded 0, skip to E0800.",
      "source": {
        "doc": "rai-manual-v1.20.1",
        "loc": "p. E-7",
        "quote": "Code 1, yes: if any of E0200A, E0200B, or E0200C were coded 1, 2, or 3. Proceed to complete Impact on Resident item (E0500), and Impact on Others item (E0600)."
      }
    },
    {
      "rule": "Code E0600 based on the behaviors identified in E0200: determine if the behaviors identified intruded on others' privacy or activities.",
      "source": {
        "doc": "rai-manual-v1.20.1",
        "loc": "p. E-11",
        "quote": "To code E0600, determine if the behaviors identified put others at significant risk of physical illness or injury, intruded on their privacy or activities, and/or interfered with their care or living environments."
      }
    },
    {
      "rule": "For E0600B, code based on whether the behavior violates other residents' privacy or interrupts other residents' performance of activities of daily living or limits engagement in or enjoyment of informal social or recreational activities to such an extent that it causes the other residents to experience distress or inconvenience, whether or not the other residents complain.",
      "source": {
        "doc": "rai-manual-v1.20.1",
        "loc": "p. E-12",
        "quote": "For E0600B, code based on whether the behavior violates other residents' privacy or interrupts other residents' performance of activities of daily living or limits engagement in or enjoyment of informal social or recreational activities to such an extent that it causes the other residents to experience distress (e.g., displeasure or annoyance) or inconvenience, whether or not the other residents complain."
      }
    },
    {
      "rule": "Resident intent must not be taken into account when coding items in Section E.",
      "source": {
        "doc": "rai-manual-v1.20.1",
        "loc": "p. E-1",
        "quote": "Resident intent should not be taken into account when coding for items in this section."
      }
    },
    {
      "rule": "Intrusion on another resident's privacy is coded 1, yes regardless of whether the other residents complain or communicate distress (example: repeatedly entering others' rooms and rummaging through belongings).",
      "source": {
        "doc": "rai-manual-v1.20.1",
        "loc": "p. E-13",
        "quote": "Rationale: This is an intrusion and violates other residents' privacy regardless of whether they complain or communicate their distress."
      }
    },
    {
      "rule": "Behavior that intrudes only on an activity organized or run by staff (e.g., an exercise group or discussion group) is coded 0, no for E0600B (coded under E0600C instead).",
      "source": {
        "doc": "rai-manual-v1.20.1",
        "loc": "p. E-13",
        "quote": "Coding: E0600A and E0600B would be coded 0, no; E0600C would be coded 1, yes."
      }
    }
  ],
  "supportive_documentation": {
    "federal": [
      {
        "criterion": "Review of the clinical record for the 7-day look-back period.",
        "source": {
          "doc": "rai-manual-v1.20.1",
          "loc": "p. E-11",
          "quote": "Consider the previous review of the clinical record, staff interviews across all shifts and disciplines, interviews with others who had close interactions with the resident and previous observations of the behaviors identified in E0200 for the 7-day look-back period."
        },
        "verified_by_expert": false,
        "audit_weight": "medium",
        "notes": "Listed as step 1 of Steps for Assessment for E0600."
      },
      {
        "criterion": "Staff interviews across all shifts and disciplines, and interviews with others who had close interactions with the resident.",
        "source": {
          "doc": "rai-manual-v1.20.1",
          "loc": "p. E-11",
          "quote": "staff interviews across all shifts and disciplines, interviews with others who had close interactions with the resident"
        },
        "verified_by_expert": false,
        "audit_weight": "medium"
      },
      {
        "criterion": "Prior observations of the behaviors identified in E0200 during the 7-day look-back period.",
        "source": {
          "doc": "rai-manual-v1.20.1",
          "loc": "p. E-11",
          "quote": "previous observations of the behaviors identified in E0200 for the 7-day look-back period"
        },
        "verified_by_expert": false,
        "audit_weight": "medium"
      }
    ],
    "state": {}
  },
  "state_deltas": [],
  "case_mix_relevance": {
    "level": "unknown",
    "notes": "The supplied pages do not tie E0600B to any payment or case-mix classification."
  },
  "conflicts": [],
  "common_audit_citations": [],
  "not_found": [
    "case_mix_relevance.level",
    "state_deltas",
    "common_audit_citations"
  ],
  "provenance_summary": {
    "extracted_at": "2026-09-06",
    "model": "claude-opus-5",
    "extractor_version": "0.1.0",
    "expert_review_status": "unreviewed",
    "source_documents": [
      {
        "doc": "rai-manual-v1.20.1"
      }
    ]
  },
  "version": "0.1.0"
}
